{
  "protocol": "pocket-data/v1",
  "identity": {
    "id": "earth.pocket.example.books-small",
    "name": "一册示例书架",
    "version": "1.0.0",
    "author": "Pocket Earth",
    "description": "用于验证第三方书籍 Data Pack 导入的最小示例"
  },
  "schema": {
    "name": "pocket.books/v1",
    "version": "1.0.0",
    "record_count": 1
  },
  "compatibility": {
    "skills": ["pocket.books"],
    "runtime_min": "1.0.0"
  },
  "privacy": "public",
  "provenance": {
    "source": "Pocket Earth protocol example",
    "license": "CC0-1.0",
    "generated_at": "2026-08-10T00:00:00.000Z"
  },
  "distribution": {
    "mode": "inline"
  },
  "records": [
    {
      "id": "book:example-001",
      "title": "小王子",
      "author": "安托万·德·圣埃克苏佩里",
      "country": "法国",
      "type": "寓言",
      "year": 1943,
      "rating": null,
      "date": "",
      "synopsis": "一个来自小行星的孩子在旅途中重新理解爱、责任与告别。",
      "locations": [
        {
          "kind": "author",
          "place": "里昂 · 法国",
          "lng": 4.8357,
          "lat": 45.764,
          "confidence": 0.95
        }
      ]
    }
  ]
}

