{
  "protocol": "pocket-data/v1",
  "identity": {
    "id": "earth.pocket.examples.photos",
    "name": "Pocket Photos Example",
    "version": "1.0.0",
    "author": "Pocket Earth",
    "description": "只含可同步元数据、不含私人原图的照片示例。"
  },
  "schema": { "name": "pocket.photos/v1", "version": "1.0.0", "record_count": 1 },
  "compatibility": { "skills": ["pocket.photos"], "runtime_min": "1.0.0" },
  "privacy": "private",
  "provenance": { "source": "user-selected photo metadata", "license": "private-use", "generated_at": "2026-08-25T00:00:00.000Z" },
  "distribution": { "mode": "inline" },
  "records": [
    {
      "id": "photo:example:west-lake-rain",
      "title": "西湖雨夜",
      "city": "杭州",
      "date": "2026-08-24",
      "lat": 30.25,
      "lng": 120.15,
      "thumbnailUrl": "",
      "contentHash": "example-west-lake-rain",
      "summary": "低照度但有清晰叙事。"
    }
  ]
}
