{
  "protocol": "pocket-data/v1",
  "identity": {
    "id": "earth.pocket.example.movies-small",
    "name": "一部示例片库",
    "version": "1.0.0",
    "author": "Pocket Earth",
    "description": "用于验证第三方电影 Data Pack 导入的最小示例"
  },
  "schema": {
    "name": "pocket.movies/v1",
    "version": "1.0.0",
    "record_count": 1
  },
  "compatibility": {
    "skills": ["pocket.movies"],
    "runtime_min": "1.0.0"
  },
  "privacy": "public",
  "provenance": {
    "source": "Pocket Earth protocol example",
    "license": "CC0-1.0",
    "generated_at": "2026-08-10T00:00:00.000Z"
  },
  "distribution": {
    "mode": "inline"
  },
  "records": [
    {
      "id": "movie:example-001",
      "title": "电影示例",
      "original": "Example Film",
      "type": "短片",
      "director": "Example Director",
      "country": "法国",
      "year": 2026,
      "rating": null,
      "publicRating": null,
      "date": "",
      "synopsis": "一条只用于验证协议和导入流程的虚构测试记录。",
      "locations": [
        {
          "kind": "story",
          "place": "巴黎 · 法国",
          "lng": 2.3522,
          "lat": 48.8566,
          "confidence": 1
        }
      ]
    }
  ]
}
